{
  "schema_version":"1.0","document_id":"NSI-POL-PEO-001","title":"Política de Férias e Benefícios","description":"Orientação administrativa fictícia sobre planejamento de férias e consulta de benefícios.","category":"people-policy","format":"pdf","version":"1.0","effective_date":"2026-01-01","owner_area":"Área de Pessoas","owner_contact":"pessoas@nexosaude.example","language":"pt-BR","classification":"public-demo-fictitious","fictitious":true,"source_type":"generated-from-canonical","output_filename":"politica_ferias_beneficios_v1_0.pdf","locator_strategy":"page-and-section","fictitious_notice":"Documento fictício criado exclusivamente para fins educacionais. Não representa políticas, dados ou operações de uma organização real.",
  "content":{"sections":[
    {"heading":"1. Objetivo e caráter demonstrativo","paragraphs":["Esta política simula referências administrativas para planejamento de férias e consulta de benefícios em uma empresa fictícia. Foi preparada exclusivamente para fins educacionais e para testar geração documental do NexoDocs AI. Não representa contrato, regulamento trabalhista, prática de mercado ou orientação aplicável a uma organização real. Não são usados nomes de pessoas, valores financeiros, dados cadastrais reais ou informações que permitam identificar colaboradores."]},
    {"heading":"2. Público e planejamento anual","paragraphs":["O público desta demonstração é formado por equipes administrativas fictícias. Cada área organiza seu planejamento anual de períodos desejados de forma interna e demonstrativa, buscando continuidade das atividades. O planejamento não garante aprovação automática nem cria direito individual. A Área de Pessoas mantém somente referências administrativas necessárias para o exercício, sem registrar dados pessoais reais. Questões sobre condições de trabalho reais devem ser tratadas por canais e profissionais apropriados fora desta base."]},
    {"heading":"3. Solicitação e antecedência","paragraphs":["Para esta simulação, uma solicitação de férias deve ser encaminhada com antecedência de 30 dias corridos ao canal pessoas@nexosaude.example. O pedido contém somente período proposto e identificação administrativa fictícia. A regra existe para permitir organização e não deve ser interpretada como requisito jurídico. Mensagens não devem conter documentos de identidade, endereço, telefone, informações familiares ou qualquer outro dado real."]},
    {"heading":"4. Análise e resposta","paragraphs":["A liderança administrativa fictícia analisa a compatibilidade do período com a continuidade das atividades e registra sua posição para acompanhamento. A Área de Pessoas busca responder em até 5 dias úteis, contados apenas como referência interna do cenário educacional. A resposta formaliza se o período está aprovado, se requer ajuste ou se aguarda nova proposta. Nenhuma resposta desta simulação substitui orientação trabalhista, jurídica ou contábil."]},
    {"heading":"5. Alterações e continuidade","paragraphs":["Uma alteração do período solicitado pode ser apresentada pelo mesmo canal enquanto o registro demonstrativo estiver aberto. A análise considera a continuidade fictícia das atividades, a disponibilidade de cobertura administrativa e a organização do calendário. A aprovação final é registrada de modo formal no fluxo simulado. Não há compensações, pagamentos, descontos, saldos ou valores monetários descritos neste documento, pois esses temas não pertencem ao objetivo educacional."]},
    {"heading":"6. Benefícios e atualização cadastral","paragraphs":["Consultas administrativas sobre benefícios demonstrativos podem ser encaminhadas à Área de Pessoas. A resposta limita-se a explicar o fluxo e a necessidade de confirmação administrativa, sem fornecer valores, condições financeiras ou decisões individuais. Atualizações cadastrais reais não devem ser feitas neste ambiente. Quando o exercício exigir exemplo de atualização, utiliza-se apenas referência abstrata e fictícia, mantendo a proteção contra exposição de dados pessoais."]},
    {"heading":"7. Dúvidas e limites","paragraphs":["Dúvidas sobre esta política educacional devem ser encaminhadas a pessoas@nexosaude.example, contato pertencente ao diretório corporativo fictício. A Área de Pessoas pode esclarecer a organização do exemplo e o estado de um registro simulado. Esta política não substitui orientação trabalhista, jurídica, financeira ou profissional. Ela deve ser consultada juntamente com o aviso de conteúdo fictício e não deve ser aplicada a relações de trabalho reais."]}
  ]}
}
