{
  "schema_version":"1.0","document_id":"NSI-POL-OPS-001","title":"Política de Cancelamentos e Reagendamentos","description":"Orientação administrativa fictícia para solicitações de cancelamento e reagendamento.","category":"operational-policy","format":"pdf","version":"1.0","effective_date":"2026-01-01","owner_area":"Área de Relacionamento","owner_contact":"relacionamento@nexosaude.example","language":"pt-BR","classification":"public-demo-fictitious","fictitious":true,"source_type":"generated-from-canonical","output_filename":"politica_cancelamentos_reagendamentos_v1_0.pdf","locator_strategy":"page-and-section","fictitious_notice":"Documento fictício criado exclusivamente para fins educacionais. Não representa políticas, dados ou operações de uma organização real.",
  "content":{"sections":[
    {"heading":"1. Objetivo e natureza educacional","paragraphs":["Esta política apresenta uma simulação educacional de procedimentos administrativos para cancelamentos e reagendamentos. Ela foi criada para demonstrar uma base documental organizada da Nexo Saúde Integrada, empresa inteiramente fictícia. O texto não descreve uma clínica real, não orienta decisões de saúde e não cria direitos, obrigações ou compromissos para qualquer organização existente. Seu uso é limitado ao exercício técnico do NexoDocs AI e à consulta administrativa demonstrativa."]},
    {"heading":"2. Escopo administrativo","paragraphs":["O escopo compreende apenas o registro, a confirmação e o acompanhamento administrativo de solicitações relacionadas a horários demonstrativos. A política aplica-se às unidades fictícias Nexo Centro, Nexo Norte e Nexo Sul. Situações clínicas, prioridades de saúde, diagnósticos, tratamentos e decisões profissionais estão expressamente fora deste documento. Quando uma solicitação contiver tema clínico, o registro administrativo deve indicar que o assunto não é tratado por esta política educacional."]},
    {"heading":"3. Canais e horário administrativo","paragraphs":["As solicitações demonstrativas devem ser encaminhadas ao canal relacionamento@nexosaude.example. O canal representa uma área fictícia e não recebe dados pessoais reais. Para fins de exemplo, o horário administrativo é composto por dias úteis, em período comercial demonstrativo. A mensagem deve conter somente a referência administrativa necessária para localizar o registro fictício. Não devem ser enviados documentos pessoais, dados sensíveis ou informações de saúde para esta demonstração."]},
    {"heading":"4. Antecedência e confirmação","paragraphs":["A antecedência mínima simulada para cancelamento ou reagendamento é de 24 horas antes do horário registrado. Após receber a solicitação, a Área de Relacionamento envia uma confirmação administrativa pelo mesmo canal, indicando que o pedido foi registrado. A confirmação não representa garantia de novo horário. O registro deve manter a data fixa de vigência desta política e uma justificativa administrativa curta, sem detalhes clínicos ou dados pessoais reais."]},
    {"heading":"5. Reagendamento e disponibilidade","paragraphs":["Cada atendimento demonstrativo pode receber uma remarcação administrativa sem custo. A alternativa de horário depende exclusivamente da disponibilidade exibida no fluxo fictício e não deve ser interpretada como promessa de atendimento. Caso não exista opção disponível, a Área de Relacionamento registra a indisponibilidade e orienta a realização de nova consulta administrativa posterior. Não há multas, taxas, valores monetários ou condições financeiras nesta política."]},
    {"heading":"6. Pedidos fora do prazo e ausência","paragraphs":["Pedidos recebidos fora do prazo são registrados para fins de organização, mas podem não permitir alteração do horário demonstrativo. A ausência sem aviso também recebe somente um registro administrativo, sem penalidade financeira e sem avaliação de motivo. Se uma unidade fictícia informar indisponibilidade causada por sua operação demonstrativa, a Área de Relacionamento prioriza a comunicação de uma alternativa administrativa quando houver disponibilidade. Nenhuma dessas regras trata urgências ou condições clínicas."]},
    {"heading":"7. Registro, auditoria e escalonamento","paragraphs":["Os registros desta simulação servem para auditoria administrativa educacional, com acesso limitado à Área de Relacionamento. Dúvidas, divergências de registro ou solicitações que não possam ser concluídas no fluxo devem ser escalonadas para relacionamento@nexosaude.example. O escalonamento não substitui orientação médica, jurídica ou profissional. Esta política deve ser lida sempre com seu aviso de ficção e não deve ser usada para inferir práticas de uma organização real."]}
  ]}
}
