{
  "schema_version":"1.0","document_id":"NSI-POL-PRV-001","title":"Política de Privacidade e Proteção de Dados","description":"Orientação educacional fictícia sobre privacidade e proteção administrativa de dados.","category":"privacy-policy","format":"pdf","version":"1.0","effective_date":"2026-01-01","owner_area":"Área de Privacidade","owner_contact":"privacidade@nexosaude.example","language":"pt-BR","classification":"public-demo-fictitious","fictitious":true,"source_type":"generated-from-canonical","output_filename":"politica_privacidade_protecao_dados_v1_0.pdf","locator_strategy":"page-and-section","fictitious_notice":"Documento fictício criado exclusivamente para fins educacionais. Não representa políticas, dados ou operações de uma organização real.",
  "content":{"sections":[
    {"heading":"1. Finalidade e limites educacionais","paragraphs":["Esta política descreve princípios administrativos fictícios de privacidade e proteção de dados para demonstrar uma base documental segura. A Nexo Saúde Integrada e o NexoDocs AI são referências educacionais. O documento não estabelece aconselhamento jurídico, não interpreta legislação e não descreve controles de uma organização real. Seu objetivo é orientar o uso de conteúdo inventado, controlado e verificável durante o desenvolvimento técnico desta demonstração."]},
    {"heading":"2. Minimização e necessidade de acesso","paragraphs":["No ambiente educacional, somente informações fictícias necessárias ao exemplo podem ser registradas. A minimização evita criar campos, relatos ou anexos que não contribuam para o objetivo administrativo demonstrativo. O acesso deve ser limitado a áreas fictícias responsáveis pelo fluxo, sempre segundo a necessidade de consulta. Dados reais, inclusive identificadores, contatos pessoais e informações de saúde, são proibidos neste ambiente e não devem ser usados como material de teste."]},
    {"heading":"3. Classificação administrativa","paragraphs":["Todo material desta base recebe a classificação public-demo-fictitious e o aviso de conteúdo fictício. Essa classificação torna visível que políticas, diretórios, unidades e planos são inventados e educacionais. O conteúdo não deve ser apresentado como fonte oficial, nem ser usado para decisões sobre pessoas reais. A Área de Privacidade mantém a referência administrativa de classificação e pode orientar sobre a leitura correta dos materiais simulados."]},
    {"heading":"4. Compartilhamento interno controlado","paragraphs":["O compartilhamento interno, quando necessário ao exercício, ocorre somente entre áreas fictícias previstas no diretório corporativo. Cada uso deve respeitar a finalidade administrativa declarada e evitar cópias desnecessárias. O ambiente não admite envio para endereços externos, URLs públicas ou canais pessoais. Caso seja identificada tentativa de inserir informação real, o fluxo deve ser interrompido e o conteúdo removido do material de trabalho antes de qualquer geração documental."]},
    {"heading":"5. Retenção e descarte","paragraphs":["A retenção de conteúdo fictício é baseada apenas na finalidade educacional e na necessidade de manter o repositório reproduzível. Quando uma versão for substituída, o descarte controlado deve preservar somente os artefatos explicitamente versionados e validados. Não há prazo legal, obrigação regulatória ou regra corporativa real declarada aqui. O objetivo é ensinar que retenção e descarte devem ser deliberados, documentados e coerentes com a finalidade do material."]},
    {"heading":"6. Incidentes e solicitações","paragraphs":["Uma suspeita de inserção de dado real, credencial, contato externo ou arquivo fora do escopo deve ser reportada internamente à Área de Privacidade pelo canal privacidade@nexosaude.example. A área registra o incidente demonstrativo, orienta a interrupção segura do fluxo e encaminha a revisão administrativa adequada. Solicitações recebidas no ambiente educacional não representam exercício de direitos reais nem produzem efeito jurídico; elas servem apenas para validar o procedimento fictício."]},
    {"heading":"7. Auditoria e responsabilidades","paragraphs":["A auditoria administrativa verifica se os documentos mantêm o aviso de ficção, os contatos reservados e a ausência de padrões proibidos. A Área de Privacidade coordena essa verificação com as demais áreas fictícias do diretório. Responsabilidades descritas aqui são administrativas e educacionais, nunca individuais ou legais. Dúvidas sobre o material devem ser enviadas a privacidade@nexosaude.example. Esta política não substitui orientação jurídica ou profissional especializada."]}
  ]}
}
