{
  "schema_version":"1.0","document_id":"NSI-TAB-DIR-001","title":"Diretório de Áreas, Responsáveis e Contatos","description":"Diretório corporativo fictício de áreas e canais administrativos.","category":"contact-directory","format":"csv","version":"1.0","effective_date":"2026-01-01","owner_area":"Área de Administração","owner_contact":"administracao@nexosaude.example","language":"pt-BR","classification":"public-demo-fictitious","fictitious":true,"source_type":"generated-from-canonical","output_filename":"diretorio_areas_responsaveis_contatos_v1_0.csv","locator_strategy":"header-and-row","fictitious_notice":"Documento fictício criado exclusivamente para fins educacionais. Não representa políticas, dados ou operações de uma organização real.",
  "content":{"columns":["area_id","area_name","responsibility","contact_email","availability","response_target","status"],"rows":[
    {"area_id":"NSI-AREA-REL","area_name":"Área de Relacionamento","responsibility":"Relacionamento administrativo","contact_email":"relacionamento@nexosaude.example","availability":"Dias úteis em horário administrativo","response_target":"Até 2 dias úteis","status":"active"},
    {"area_id":"NSI-AREA-PEO","area_name":"Área de Pessoas","responsibility":"Processos administrativos de pessoas","contact_email":"pessoas@nexosaude.example","availability":"Dias úteis em horário administrativo","response_target":"Até 5 dias úteis","status":"active"},
    {"area_id":"NSI-AREA-PRV","area_name":"Área de Privacidade","responsibility":"Privacidade e proteção administrativa de dados","contact_email":"privacidade@nexosaude.example","availability":"Dias úteis em horário administrativo","response_target":"Até 3 dias úteis","status":"active"},
    {"area_id":"NSI-AREA-OPS","area_name":"Área de Operações","responsibility":"Operações administrativas","contact_email":"operacoes@nexosaude.example","availability":"Dias úteis em horário administrativo","response_target":"Até 2 dias úteis","status":"active"},
    {"area_id":"NSI-AREA-ADM","area_name":"Área de Administração","responsibility":"Administração corporativa demonstrativa","contact_email":"administracao@nexosaude.example","availability":"Dias úteis em horário administrativo","response_target":"Até 3 dias úteis","status":"active"},
    {"area_id":"NSI-AREA-TEC","area_name":"Área de Tecnologia","responsibility":"Suporte tecnológico demonstrativo","contact_email":"tecnologia@nexosaude.example","availability":"Dias úteis em horário administrativo","response_target":"Até 2 dias úteis","status":"active"},
    {"area_id":"NSI-AREA-FIN","area_name":"Área Financeira","responsibility":"Orientação financeira administrativa","contact_email":"financeiro@nexosaude.example","availability":"Dias úteis em horário administrativo","response_target":"Até 3 dias úteis","status":"active"},
    {"area_id":"NSI-AREA-CMP","area_name":"Área de Compliance","responsibility":"Conformidade administrativa demonstrativa","contact_email":"compliance@nexosaude.example","availability":"Dias úteis em horário administrativo","response_target":"Até 3 dias úteis","status":"active"}
  ]}
}
