{
  "schema_version": "1.0", "document_id": "NSI-TAB-COV-001", "title": "Convênios e Coberturas por Unidade", "description": "Diretório demonstrativo de coberturas administrativas por unidade fictícia.", "category": "coverage-directory", "format": "csv", "version": "1.0", "effective_date": "2026-01-01", "owner_area": "Área de Operações", "owner_contact": "operacoes@nexosaude.example", "language": "pt-BR", "classification": "public-demo-fictitious", "fictitious": true, "source_type": "generated-from-canonical", "output_filename": "convenios_coberturas_por_unidade_v1_0.csv", "locator_strategy": "header-and-row", "fictitious_notice": "Documento fictício criado exclusivamente para fins educacionais. Não representa políticas, dados ou operações de uma organização real.",
  "content": {"columns": ["unit_id", "unit_name", "city", "plan_id", "plan_name", "coverage_type", "status", "effective_date", "confirmation_required", "notes"], "rows": [
    {"unit_id":"NSI-UNI-001","unit_name":"Unidade Nexo Centro","city":"Cidade Demonstrativa A","plan_id":"NSI-PLAN-ESS","plan_name":"Plano Nexo Essencial","coverage_type":"Cobertura administrativa demonstrativa","status":"active","effective_date":"2026-01-01","confirmation_required":true,"notes":"Cobertura demonstrativa; necessita de confirmação administrativa."},
    {"unit_id":"NSI-UNI-001","unit_name":"Unidade Nexo Centro","city":"Cidade Demonstrativa A","plan_id":"NSI-PLAN-AMP","plan_name":"Plano Nexo Amplo","coverage_type":"Cobertura administrativa demonstrativa","status":"active","effective_date":"2026-01-01","confirmation_required":true,"notes":"Cobertura demonstrativa; necessita de confirmação administrativa."},
    {"unit_id":"NSI-UNI-001","unit_name":"Unidade Nexo Centro","city":"Cidade Demonstrativa A","plan_id":"NSI-PLAN-INT","plan_name":"Plano Nexo Integral","coverage_type":"Cobertura administrativa demonstrativa","status":"restricted","effective_date":"2026-01-01","confirmation_required":true,"notes":"Cobertura demonstrativa com disponibilidade administrativa restrita."},
    {"unit_id":"NSI-UNI-001","unit_name":"Unidade Nexo Centro","city":"Cidade Demonstrativa A","plan_id":"NSI-PLAN-PAR","plan_name":"Atendimento Particular Demonstrativo","coverage_type":"Registro administrativo demonstrativo","status":"active","effective_date":"2026-01-01","confirmation_required":false,"notes":"Registro fictício para consulta administrativa."},
    {"unit_id":"NSI-UNI-002","unit_name":"Unidade Nexo Norte","city":"Cidade Demonstrativa B","plan_id":"NSI-PLAN-ESS","plan_name":"Plano Nexo Essencial","coverage_type":"Cobertura administrativa demonstrativa","status":"active","effective_date":"2026-01-01","confirmation_required":true,"notes":"Cobertura demonstrativa; necessita de confirmação administrativa."},
    {"unit_id":"NSI-UNI-002","unit_name":"Unidade Nexo Norte","city":"Cidade Demonstrativa B","plan_id":"NSI-PLAN-AMP","plan_name":"Plano Nexo Amplo","coverage_type":"Cobertura administrativa demonstrativa","status":"restricted","effective_date":"2026-01-01","confirmation_required":true,"notes":"Cobertura demonstrativa com disponibilidade administrativa restrita."},
    {"unit_id":"NSI-UNI-002","unit_name":"Unidade Nexo Norte","city":"Cidade Demonstrativa B","plan_id":"NSI-PLAN-INT","plan_name":"Plano Nexo Integral","coverage_type":"Cobertura administrativa demonstrativa","status":"active","effective_date":"2026-01-01","confirmation_required":true,"notes":"Cobertura demonstrativa; necessita de confirmação administrativa."},
    {"unit_id":"NSI-UNI-002","unit_name":"Unidade Nexo Norte","city":"Cidade Demonstrativa B","plan_id":"NSI-PLAN-PAR","plan_name":"Atendimento Particular Demonstrativo","coverage_type":"Registro administrativo demonstrativo","status":"inactive","effective_date":"2026-01-01","confirmation_required":true,"notes":"Registro demonstrativo indisponível; confirmar administrativamente."},
    {"unit_id":"NSI-UNI-003","unit_name":"Unidade Nexo Sul","city":"Cidade Demonstrativa C","plan_id":"NSI-PLAN-ESS","plan_name":"Plano Nexo Essencial","coverage_type":"Cobertura administrativa demonstrativa","status":"active","effective_date":"2026-01-01","confirmation_required":true,"notes":"Cobertura demonstrativa; necessita de confirmação administrativa."},
    {"unit_id":"NSI-UNI-003","unit_name":"Unidade Nexo Sul","city":"Cidade Demonstrativa C","plan_id":"NSI-PLAN-AMP","plan_name":"Plano Nexo Amplo","coverage_type":"Cobertura administrativa demonstrativa","status":"active","effective_date":"2026-01-01","confirmation_required":true,"notes":"Cobertura demonstrativa; necessita de confirmação administrativa."},
    {"unit_id":"NSI-UNI-003","unit_name":"Unidade Nexo Sul","city":"Cidade Demonstrativa C","plan_id":"NSI-PLAN-INT","plan_name":"Plano Nexo Integral","coverage_type":"Cobertura administrativa demonstrativa","status":"restricted","effective_date":"2026-01-01","confirmation_required":true,"notes":"Cobertura demonstrativa com disponibilidade administrativa restrita."},
    {"unit_id":"NSI-UNI-003","unit_name":"Unidade Nexo Sul","city":"Cidade Demonstrativa C","plan_id":"NSI-PLAN-PAR","plan_name":"Atendimento Particular Demonstrativo","coverage_type":"Registro administrativo demonstrativo","status":"active","effective_date":"2026-01-01","confirmation_required":false,"notes":"Registro fictício para consulta administrativa."}
  ]}
}
